{
 "demographics": {
  "age_value": 9,
  "age_unit": "years",
  "sex": "male",
  "weight_kg": 28.8
 },
 "diagnoses": [
  {
   "name": "appendicitis",
   "status": "suspected"
  }
 ],
 "medications": [
  {
   "name": "morphine",
   "dose": 0.05,
   "dose_unit": "mg/kg/dose",
   "route": "IV",
   "frequency": "prn",
   "weight_based": true
  }
 ],
 "labs": [
  {
   "test": "WBC",
   "value": 14.9,
   "unit": "10^3/uL",
   "flag": "high"
  }
 ],
 "procedures": [
  {
   "name": "abdominal ultrasound",
   "status": "planned"
  }
 ],
 "encounter": {
  "setting": "inpatient",
  "disposition": "discharged home"
 },
 "temporal": [
  {
   "event": "prior clinic note listed the dose per day rather than per dose",
   "when": null,
   "qualifier": "historical"
  },
  {
   "event": "history of RSV bronchiolitis in infancy, resolved",
   "when": null,
   "qualifier": "historical"
  }
 ]
}