{
 "demographics": {
  "age_value": 18,
  "age_unit": "days",
  "sex": "male",
  "weight_kg": 2.9
 },
 "diagnoses": [
  {
   "name": "neonatal jaundice",
   "status": "active"
  }
 ],
 "medications": [],
 "labs": [
  {
   "test": "total bilirubin",
   "value": 14.2,
   "unit": "mg/dL",
   "flag": "high"
  }
 ],
 "procedures": [
  {
   "name": "phototherapy",
   "status": "completed"
  }
 ],
 "encounter": {
  "setting": "outpatient",
  "disposition": "discharged home"
 },
 "temporal": [
  {
   "event": "history of RSV bronchiolitis last winter, resolved",
   "when": null,
   "qualifier": "historical"
  }
 ]
}