{
 "demographics": {
  "age_value": 15,
  "age_unit": "years",
  "sex": "male",
  "weight_kg": 80.2
 },
 "diagnoses": [
  {
   "name": "major depressive disorder",
   "status": "historical"
  }
 ],
 "medications": [
  {
   "name": "sertraline",
   "dose": 50,
   "dose_unit": "mg",
   "route": "PO",
   "frequency": "q24h",
   "weight_based": false
  }
 ],
 "labs": [],
 "procedures": [
  {
   "name": "safety screening",
   "status": "completed"
  }
 ],
 "encounter": {
  "setting": "icu",
  "disposition": "transferred to inpatient unit"
 },
 "temporal": []
}