{
 "demographics": {
  "age_value": 6,
  "age_unit": "years",
  "sex": "male",
  "weight_kg": 34.8
 },
 "diagnoses": [
  {
   "name": "community-acquired pneumonia",
   "status": "active"
  }
 ],
 "medications": [
  {
   "name": "amoxicillin",
   "dose": 90,
   "dose_unit": "mg/kg/day",
   "route": "PO",
   "frequency": "q12h",
   "weight_based": true
  }
 ],
 "labs": [
  {
   "test": "WBC",
   "value": 16.2,
   "unit": "10^3/uL",
   "flag": "high"
  }
 ],
 "procedures": [
  {
   "name": "chest radiograph",
   "status": "completed"
  }
 ],
 "encounter": {
  "setting": "outpatient",
  "disposition": "discharged home"
 },
 "temporal": [
  {
   "event": "repeat CBC planned for tomorrow morning",
   "when": null,
   "qualifier": "planned"
  },
  {
   "event": "follow-up with the primary care clinic in one week",
   "when": null,
   "qualifier": "planned"
  }
 ]
}