{
 "demographics": {
  "age_value": 11,
  "age_unit": "years",
  "sex": "female",
  "weight_kg": 19.9
 },
 "diagnoses": [
  {
   "name": "status asthmaticus",
   "status": "active"
  },
  {
   "name": "fever",
   "status": "ruled_out"
  }
 ],
 "medications": [
  {
   "name": "albuterol",
   "dose": 0.5,
   "dose_unit": "mg/kg/hour",
   "route": "nebulized",
   "frequency": "continuous",
   "weight_based": true
  }
 ],
 "labs": [],
 "procedures": [
  {
   "name": "continuous pulse oximetry",
   "status": "completed"
  }
 ],
 "encounter": {
  "setting": "icu",
  "disposition": "transferred to inpatient unit"
 },
 "temporal": [
  {
   "event": "repeat CBC planned for tomorrow morning",
   "when": null,
   "qualifier": "planned"
  }
 ]
}