{
 "demographics": {
  "age_value": 2,
  "age_unit": "months",
  "sex": "female",
  "weight_kg": 5.0
 },
 "diagnoses": [
  {
   "name": "bronchiolitis",
   "status": "active"
  },
  {
   "name": "fever",
   "status": "ruled_out"
  }
 ],
 "medications": [],
 "labs": [],
 "procedures": [
  {
   "name": "nasal suctioning",
   "status": "completed"
  }
 ],
 "encounter": {
  "setting": "emergency",
  "disposition": "admitted to inpatient unit"
 },
 "temporal": [
  {
   "event": "history of mild eczema, well controlled",
   "when": null,
   "qualifier": "historical"
  },
  {
   "event": "repeat CBC planned for tomorrow morning",
   "when": null,
   "qualifier": "planned"
  }
 ]
}