{
 "demographics": {
  "age_value": 5,
  "age_unit": "years",
  "sex": "male",
  "weight_kg": 17.5
 },
 "diagnoses": [
  {
   "name": "asthma exacerbation",
   "status": "active"
  }
 ],
 "medications": [
  {
   "name": "prednisolone",
   "dose": 2,
   "dose_unit": "mg/kg/day",
   "route": "PO",
   "frequency": "q24h",
   "weight_based": true
  }
 ],
 "labs": [],
 "procedures": [
  {
   "name": "peak flow measurement",
   "status": "completed"
  }
 ],
 "encounter": {
  "setting": "inpatient",
  "disposition": "discharged home"
 },
 "temporal": [
  {
   "event": "history of RSV bronchiolitis last winter, resolved",
   "when": null,
   "qualifier": "historical"
  },
  {
   "event": "follow-up echocardiogram to be scheduled",
   "when": null,
   "qualifier": "planned"
  }
 ]
}