{
 "demographics": {
  "age_value": 2,
  "age_unit": "days",
  "sex": "male",
  "weight_kg": 3.4
 },
 "diagnoses": [
  {
   "name": "early-onset sepsis",
   "status": "suspected"
  },
  {
   "name": "fever",
   "status": "ruled_out"
  }
 ],
 "medications": [
  {
   "name": "ampicillin",
   "dose": 100,
   "dose_unit": "mg/kg/dose",
   "route": "IV",
   "frequency": "q8h",
   "weight_based": true
  }
 ],
 "labs": [
  {
   "test": "WBC",
   "value": 4.1,
   "unit": "10^3/uL",
   "flag": "low"
  }
 ],
 "procedures": [
  {
   "name": "lumbar puncture",
   "status": "completed"
  }
 ],
 "encounter": {
  "setting": "inpatient",
  "disposition": "discharged home"
 },
 "temporal": [
  {
   "event": "born at term with unknown maternal group B streptococcus status",
   "when": null,
   "qualifier": "historical"
  },
  {
   "event": "repeat CBC planned for tomorrow morning",
   "when": null,
   "qualifier": "planned"
  }
 ]
}