{
 "demographics": {
  "age_value": 15,
  "age_unit": "years",
  "sex": "male",
  "weight_kg": 85.5
 },
 "diagnoses": [
  {
   "name": "sports-related concussion",
   "status": "active"
  }
 ],
 "medications": [
  {
   "name": "acetaminophen",
   "dose": 650,
   "dose_unit": "mg",
   "route": "PO",
   "frequency": "prn",
   "weight_based": false
  }
 ],
 "labs": [],
 "procedures": [
  {
   "name": "head CT",
   "status": "planned"
  }
 ],
 "encounter": {
  "setting": "outpatient",
  "disposition": "discharged home"
 },
 "temporal": [
  {
   "event": "repeat CBC planned for tomorrow morning",
   "when": null,
   "qualifier": "planned"
  }
 ]
}