{
 "demographics": {
  "age_value": 13,
  "age_unit": "years",
  "sex": "male",
  "weight_kg": 65.2
 },
 "diagnoses": [
  {
   "name": "diabetic ketoacidosis",
   "status": "active"
  },
  {
   "name": "fever",
   "status": "ruled_out"
  }
 ],
 "medications": [
  {
   "name": "insulin",
   "dose": 0.1,
   "dose_unit": "units/kg/hour",
   "route": "IV",
   "frequency": "continuous",
   "weight_based": true
  }
 ],
 "labs": [
  {
   "test": "glucose",
   "value": 486,
   "unit": "mg/dL",
   "flag": "high"
  }
 ],
 "procedures": [
  {
   "name": "venous blood gas",
   "status": "completed"
  }
 ],
 "encounter": {
  "setting": "inpatient",
  "disposition": "discharged home"
 },
 "temporal": [
  {
   "event": "repeat CBC planned for tomorrow morning",
   "when": null,
   "qualifier": "planned"
  },
  {
   "event": "follow-up with the primary care clinic in one week",
   "when": null,
   "qualifier": "planned"
  }
 ]
}