{
 "demographics": {
  "age_value": 17,
  "age_unit": "years",
  "sex": "male",
  "weight_kg": 56.2
 },
 "diagnoses": [
  {
   "name": "diabetic ketoacidosis",
   "status": "active"
  }
 ],
 "medications": [
  {
   "name": "insulin",
   "dose": 0.1,
   "dose_unit": "units/kg/hour",
   "route": "IV",
   "frequency": "continuous",
   "weight_based": true
  }
 ],
 "labs": [
  {
   "test": "glucose",
   "value": 486,
   "unit": "mg/dL",
   "flag": "high"
  }
 ],
 "procedures": [
  {
   "name": "venous blood gas",
   "status": "completed"
  }
 ],
 "encounter": {
  "setting": "emergency",
  "disposition": "admitted to inpatient unit"
 },
 "temporal": []
}