{
 "demographics": {
  "age_value": 11,
  "age_unit": "years",
  "sex": "male",
  "weight_kg": 21.2
 },
 "diagnoses": [
  {
   "name": "asthma exacerbation",
   "status": "active"
  }
 ],
 "medications": [
  {
   "name": "prednisolone",
   "dose": 2,
   "dose_unit": "mg/kg/day",
   "route": "PO",
   "frequency": "q24h",
   "weight_based": true
  }
 ],
 "labs": [],
 "procedures": [
  {
   "name": "peak flow measurement",
   "status": "completed"
  }
 ],
 "encounter": {
  "setting": "inpatient",
  "disposition": "discharged home"
 },
 "temporal": []
}