{
 "demographics": {
  "age_value": 5,
  "age_unit": "years",
  "sex": "female",
  "weight_kg": 31.5
 },
 "diagnoses": [
  {
   "name": "appendicitis",
   "status": "suspected"
  }
 ],
 "medications": [
  {
   "name": "morphine",
   "dose": 0.05,
   "dose_unit": "mg/kg/dose",
   "route": "IV",
   "frequency": "prn",
   "weight_based": true
  }
 ],
 "labs": [
  {
   "test": "WBC",
   "value": 14.9,
   "unit": "10^3/uL",
   "flag": "high"
  }
 ],
 "procedures": [
  {
   "name": "abdominal ultrasound",
   "status": "planned"
  }
 ],
 "encounter": {
  "setting": "icu",
  "disposition": "transferred to inpatient unit"
 },
 "temporal": [
  {
   "event": "repeat CBC planned for tomorrow morning",
   "when": null,
   "qualifier": "planned"
  }
 ]
}