{
 "demographics": {
  "age_value": 13,
  "age_unit": "years",
  "sex": "female",
  "weight_kg": 76.3
 },
 "diagnoses": [
  {
   "name": "diabetic ketoacidosis",
   "status": "active"
  }
 ],
 "medications": [
  {
   "name": "insulin",
   "dose": 0.1,
   "dose_unit": "units/kg/hour",
   "route": "IV",
   "frequency": "continuous",
   "weight_based": true
  }
 ],
 "labs": [
  {
   "test": "glucose",
   "value": 486,
   "unit": "mg/dL",
   "flag": "high"
  }
 ],
 "procedures": [
  {
   "name": "venous blood gas",
   "status": "completed"
  }
 ],
 "encounter": {
  "setting": "outpatient",
  "disposition": "discharged home"
 },
 "temporal": [
  {
   "event": "history of RSV bronchiolitis last winter, resolved",
   "when": null,
   "qualifier": "historical"
  }
 ]
}