{
 "demographics": {
  "age_value": 11,
  "age_unit": "years",
  "sex": "female",
  "weight_kg": 27.9
 },
 "diagnoses": [
  {
   "name": "asthma exacerbation",
   "status": "active"
  },
  {
   "name": "fever",
   "status": "ruled_out"
  }
 ],
 "medications": [
  {
   "name": "prednisolone",
   "dose": 2,
   "dose_unit": "mg/kg/day",
   "route": "PO",
   "frequency": "q24h",
   "weight_based": true
  }
 ],
 "labs": [],
 "procedures": [
  {
   "name": "peak flow measurement",
   "status": "completed"
  }
 ],
 "encounter": {
  "setting": "outpatient",
  "disposition": "discharged home"
 },
 "temporal": [
  {
   "event": "repeat CBC planned for tomorrow morning",
   "when": null,
   "qualifier": "planned"
  }
 ]
}