{
 "demographics": {
  "age_value": 4,
  "age_unit": "days",
  "sex": "female",
  "weight_kg": 3.5
 },
 "diagnoses": [
  {
   "name": "neonatal jaundice",
   "status": "active"
  },
  {
   "name": "penicillin allergy",
   "status": "ruled_out"
  }
 ],
 "medications": [],
 "labs": [
  {
   "test": "total bilirubin",
   "value": 14.2,
   "unit": "mg/dL",
   "flag": "high"
  }
 ],
 "procedures": [
  {
   "name": "phototherapy",
   "status": "completed"
  }
 ],
 "encounter": {
  "setting": "outpatient",
  "disposition": "discharged home"
 },
 "temporal": [
  {
   "event": "born at 36 weeks gestation, exclusively breastfed",
   "when": null,
   "qualifier": "historical"
  },
  {
   "event": "repeat CBC planned for tomorrow morning",
   "when": null,
   "qualifier": "planned"
  },
  {
   "event": "born by uncomplicated vaginal delivery",
   "when": null,
   "qualifier": "historical"
  }
 ]
}