{
 "demographics": {
  "age_value": 1,
  "age_unit": "days",
  "sex": "male",
  "weight_kg": 3.6
 },
 "diagnoses": [
  {
   "name": "hypoglycemia of the newborn",
   "status": "active"
  }
 ],
 "medications": [
  {
   "name": "dextrose 10%",
   "dose": 2,
   "dose_unit": "mL/kg",
   "route": "IV",
   "frequency": "once",
   "weight_based": true
  }
 ],
 "labs": [
  {
   "test": "glucose",
   "value": 38,
   "unit": "mg/dL",
   "flag": "low"
  }
 ],
 "procedures": [
  {
   "name": "heel-stick glucose check",
   "status": "completed"
  }
 ],
 "encounter": {
  "setting": "icu",
  "disposition": "transferred to inpatient unit"
 },
 "temporal": [
  {
   "event": "pregnancy complicated by gestational diabetes",
   "when": null,
   "qualifier": "historical"
  },
  {
   "event": "repeat CBC planned for tomorrow morning",
   "when": null,
   "qualifier": "planned"
  }
 ]
}